dlga_start:member_chat|Not shown!{***}
dlga_merchant_quest_brief:escort_merchant_caravan_quest_brief|I am going to send a caravan of goods to {s8}.However, with all those pirates out in the open, I don't want to send them out without an proper escort.If you can lead that caravan to {s8} in 15 days, you will earn {reg8} piastres.Of course your party needs to be at least {reg4} strong to offer them any protection.{***}
dlga_escort_merchant_caravan_quest_brief:merchant_quest_taken|Alright. I will escort the caravan.{***}
dlga_escort_merchant_caravan_quest_brief:merchant_quest_stall|I am afraid I don't have that many soldiers with me.{***}
dlga_escort_merchant_caravan_quest_brief:merchant_quest_stall.1|Sorry. I can't do that right now{***}
dlga_merchant_quest_brief:troublesome_bandits_quest_brief|I will pay you {reg8} piastres if you find those pirates and put them to sword.It's a dangerous work, but I believe you to be capable for doing it.What say you?{***}
dlga_troublesome_bandits_quest_brief:merchant_quest_taken_bandits|Very well. I will hunt down those pirates.{***}
dlga_merchant_quest_taken_bandits:close_window|You will? Splendid. Good luck to you.{***}
dlga_troublesome_bandits_quest_brief:merchant_quest_stall|Sorry. I don't have time for this right now.{***}
dlga_merchant_quest_brief:kidnapped_girl_quest_brief|The ransom they demand is {reg12} piastres.I have the money ready and will hand the ransom to you at once if you agree to meet up with them.The outlaws arranged the rendezvous near the village of {s4}, in 15 days.If I won't pay them in due time, the bastards promised they will send the poor woman in parts to me... *and* to my wife.Please arrange for her safety, and I will pay you {reg8} piastres once you bring her back.{***}
dlga_kidnapped_girl_quest_brief:kidnapped_girl_quest_taken|Very well. I will deliver the ransom to the outlaws and ensure the release of your lover.{***}
dlga_kidnapped_girl_quest_taken:close_window|You're my savior. I had hoped I could trust you at this.Here is the entire ransom, {reg12} piastres. Please count it.And by God, don't do anything we both might regret later.The safety of the woman matters more than money or justice!{***}
dlga_kidnapped_girl_quest_brief:merchant_quest_stall|My apologies, I don't have time for this at the moment.{***}
dlga_merchant_quest_brief:merchant_quest_persuade_peace_3|On both sides, there are those who'd rather see the war over and the peace agreed upon.However, a few powerful nobles are obsessed with keeping the war rage on.{reg0?They:These men} urge others to keep fighting and ignore the pleas for an armistice.As long as these warmongers remain in charge, there will be no reconcilement.{***}
dlga_merchant_quest_persuade_peace_3:merchant_quest_persuade_peace_4|Who are these warmongers you speak of?{***}
dlga_merchant_quest_persuade_peace_4:merchant_quest_persuade_peace_5|{s12} of {s15} and {s13} of {s14}. As long as they don't change their mind nor fall from their liege's grace,there will be no peace between the two sides.{***}
dlga_merchant_quest_persuade_peace_5:merchant_quest_persuade_peace_6|And how do I come into the picture?{***}
dlga_merchant_quest_persuade_peace_6:merchant_quest_persuade_peace_7|Well, someone just has to either make them change their mind, or lose their influence. Sounds easy, eh?A determined, convincing speaker might be able to persuade them to lay down their arms and embrace like brothers. Stranger things used to happen, not often though.And then there is a realistic, if difficult, way -- beat them both up in battle and take them prisoner. They won't be influential much in a dungeon.Once both are safely locked up, the peace talks may finally proceed. And who knows, they might come to terms themselves if chained in one cell, haha.So what do you think? Sounds challenging enough for you?{***}
dlga_merchant_quest_persuade_peace_7:merchant_quest_persuade_peace_8|Just about as ambitious as I love it.{***}
dlga_merchant_quest_persuade_peace_8:merchant_quest_persuade_peace_9|The merchants of the city will be glad to pay anything to make the war stop.We can collect {reg12} piastres between ourselves, I reckon.Bring us peace, and we will be happy to reward you with that sum.Convince {s12} and {s13} to reconcile,and if either of them proves too stubborn, defeat him and lock him up until a settlement is reached.{***}
dlga_merchant_quest_persuade_peace_9:merchant_quest_persuade_peace_10|All right. I will do what I can.{***}
dlga_merchant_quest_persuade_peace_10:close_window|Excellent. You have our prayers.I hope you can handle those two warthogs.We will wait for the good news.{***}
dlga_merchant_quest_persuade_peace_9:merchant_quest_persuade_peace_no|Sorry. That sounds too complex for my taste.{***}
dlga_merchant_quest_persuade_peace_no:close_window|Do not refuse right away, think of it for a while.If there is one {man/lady} in the Caribbean able to do this, it is you.{***}
dlga_merchant_quest_persuade_peace_7:merchant_quest_persuade_peace_8.1|Name your price.{***}
dlga_merchant_quest_persuade_peace_7:merchant_quest_persuade_peace_8.2|Not a chance. I'd rather keep my hide.{***}
dlga_merchant_quest_persuade_peace_5:merchant_quest_persuade_peace_6.1|It seems nothing can be done about it.{***}
dlga_merchant_quest_persuade_peace_3:merchant_quest_persuade_peace_4.1|Which nobles do you have in mind?{***}
dlga_merchant_quest_brief:merchant_quest_deal_with_night_bandits|Some new gang is out there, preying on tonwnspeople in the nighttime then disappearing before any guard could so much as spot them.There were numerous assaults, and yet we weren't able to catch just one of them.They only attack lone travellers, and so far dared not to ambush armed groups.That's where you come in. I need someone who can take on these brigands alone and win. I see no other way to deal with them anymore.{***}
dlga_merchant_quest_deal_with_night_bandits:deal_with_night_bandits_quest_taken|Lure a bunch of brigands to their doom? With pleasure!{***}
dlga_deal_with_night_bandits_quest_taken:mayor_pretalk|Splendid, {playername}.You can expect a fine reward if you slaughter the bastards. Just don't get yourself killed, eh?{***}
dlga_merchant_quest_deal_with_night_bandits:merchant_quest_stall|Uh, umm, I don't think I could handle them alone.{***}
dlga_merchant_quest_brief:move_cattle_herd_quest_brief|The cattle herd must be at {s13} within 30 days. The sooner the better, of course,but it must be absolutely no later than 30 days.If you can do that, I'd be willing to pay you {reg8} piastres for your trouble. Interested?{***}
dlga_move_cattle_herd_quest_brief:move_cattle_herd_quest_taken|Yes, I can drive the herd to {s13}.{***}
dlga_move_cattle_herd_quest_taken:mayor_pretalk|Splendid. You can find the herd right outside the town.After you take the animals to {s13}, return back to me and I will give you your pay.{***}
dlga_move_cattle_herd_quest_brief:merchant_quest_stall|I am sorry, but no.{***}
dlga_merchant_quest_requested:merchant_quest_explain_2|Well, there is something important you could do for us indeed. You may have heard about an occasional {s10} incursion on our territory. While {s5} is hard-pressed by {reg0?her:his} nobles to respond with an all-out attack, we would rather maintain the uneasy peace. Peace is good for trade, you know.{***}
dlga_merchant_quest_explain_2:merchant_quest_brief|Of course, we are not suggesting it that {s5} should bend over and tolerate their impudence, not at all. But if {reg0?she:he} demands one of {reg0?her:his} governors to enact proper retribution, this will invariably lead to a war. On the other hand, if an outsider steps in and puts a particularly insufferable {s10} noble into place, that could restore some order without making us both slide towards open warfare. Take {s7}, for instance -- even other {s10} leaders wouldn't particularly mind it if he gets a lesson taught to him.{***}
dlga_merchant_quest_requested:merchant_quest_brief.1|Just {s4}, some travellers en route {reg4?to:from} {s5} were attacked by {s7}.{***}
dlga_merchant_quest_requested:merchant_quest_brief.2|You're looking for a job?Actually I was looking for someone to deliver some {s4}.Perhaps you can do that...{***}
dlga_merchant_quest_requested:merchant_quest_brief.3|You're looking for a job?Actually I was looking for someone to escort a caravan.Perhaps you can do that...{***}
dlga_merchant_quest_requested:merchant_quest_brief.4|Actually, I was looking for an able mercenary to do some bounty-hunting business.You see, a band of pirates has infested the local countryside as of late.They are preying on my caravans and ships alike for some time,and keep slipping away from the soldiers sent to punish them.A few more such attacks, and I am completely broke.{***}
dlga_merchant_quest_requested:merchant_quest_brief.5|Actually, I do have the utmost need of a {man/helper} of discretion.There is a... certain woman I hold very dear to me. Unfortunately, that became known to a gang of outlaws. The bastards have kidnapped her, and demand ransom for her release.I am willing to pay them anything, but there are... certain issues preventing me from handling the matter myself. My wife, my social standing, you have to understand.So, someone else has to meet them in secrecy and buy back the freedom of the woman in question.{***}
dlga_merchant_quest_requested:merchant_quest_persuade_peace_1|The war between {s15} and {s14} is devastating for our trade.Our fleet is being preyed upon by warships and privateers.The merchants fear to leave the relative safety of the walls.And to add insult to an injury, the rising war taxes take away anything we manage to make despite the odds.A few more weeks of fighting, and this town is as good as gone.{***}
dlga_merchant_quest_persuade_peace_1:merchant_quest_brief|The times are hard for your citizens. But who can leash back the hounds of war?{***}
dlga_merchant_quest_persuade_peace_1:merchant_quest_persuade_peace_reject|It is your duty as subjects to help your betters in their war effort.{***}
dlga_merchant_quest_persuade_peace_reject:close_window|Oh really? Our 'betters' fight their wars for the sake of their vanity and greed.And yet it is us honest folk who have to pay for the noble ambitions with our silver and our blood.But you are obviously too stuck up to understand that.{***}
dlga_merchant_quest_requested:merchant_quest_deal_with_night_bandits|That I do. The city streets after dark are never safe, but as of late, 'unsafe' has got a whole new meaning.Some new gang is out there, preying on tonwnspeople in the nighttime then disappearing before any guard could so much as spot them.There were numerous assaults, and yet we weren't able to catch just one of them.They only attack lone travellers, and so far dared not to ambush armed groups.That's where you come in. I need someone who can take on these brigands alone and win. I see no other way to deal with them anymore.{***}
dlga_merchant_quest_requested:merchant_quest_brief.6|One of the merchants here seeks cattle-drivers to take his cattle to the market at {s13}.{***}
dlga_merchant_quest_requested:mayor_pretalk|I am afraid I don't have any jobs for you at the moment.{***}
dlga_mayor_talk:merchant_quest_last_offered_job|About that job you had for me...{***}
dlga_merchant_quest_last_offered_job:merchant_quest_brief|Eh, you want to reconsider that. Good...{***}
dlga_mayor_talk:merchant_quest_about_job|About that job you gave me...{***}
dlga_merchant_quest_about_job:merchant_quest_about_job_2|What about it?{***}
dlga_merchant_quest_about_job_2:merchant_quest_what_if_fail|What if I can't finish it?{***}
dlga_merchant_quest_what_if_fail:mayor_pretalk|I hope you don't fail. If you do, I'll have to ask for the cost of the cargo you were carrying.{***}
dlga_merchant_quest_what_if_fail:mayor_pretalk.1|Well, just do your best to succeed.{***}
dlga_merchant_quest_about_job_2:merchant_quest_about_job_working|I'm still working on it.{***}
dlga_merchant_quest_about_job_working:mayor_pretalk|Good. I'm sure you will handle it.{***}
dlga_merchant_quest_about_job_2:lost_kidnapped_girl|I am sorry. On my way back, I've lost the woman.{***}
dlga_lost_kidnapped_girl:lost_kidnapped_girl_2|Oh... Oh no... No!{***}
dlga_lost_kidnapped_girl_2:lost_kidnapped_girl_3|I'm truly sorry. I couldn't do anything, she just disappeared in the night.{***}
dlga_lost_kidnapped_girl_3:lost_kidnapped_girl_4|You hurt me, {playername}. I put my hopes into you, and you are breaking my heart.I can't be speaking openly about this issue, but rest assured, people will know of your incompetence.Also, I want that {reg8} piastres I gave you as the ransom back.{***}
dlga_lost_kidnapped_girl_4:merchant_quest_about_job_5a|Naturally. Here you are...{***}
dlga_merchant_quest_about_job_5a:close_window|At least you have the decency to return the money.{***}
dlga_lost_kidnapped_girl_4:merchant_quest_about_job_5b|Sorry. I don't have that amount with me.{***}
dlga_merchant_quest_about_job_5b:close_window|I should have you whipped and hanged, you scum. Go and do not return without my money!{***}
dlga_mayor_talk:mayor_political_talk|I have some inquiries about local politics.{***}
dlga_mayor_political_talk:mayor_political_questions|Politics? Good God, the guild wants nothing to do with politics. We are loyal subjects of {s10}. We just look after our own affairs, and pass on the townspeople's concerns to our governors, and maybe warn them from time to time against evil advice. Anyway, what did you wish to ask?{***}
dlga_mayor_political_questions:mayor_war_description_1|What causes all these wars in the region?{***}
dlga_mayor_war_description_1:mayor_war_description_2|This is a new, untamed world ripe for plundering, that's what. Spain were here first, and claimed the Americas for their own, but they couldn't keep the others out. The English, the French, the Dutch, they all come here looking for whatever scraps they can grab and hold. Then there is the Brotherhood of the Coast, whom even Spain has to grudgingly tolerate as a power in its own right. Add infighting between the protestants and the catholics, and you get a hotbed of conflict.{***}
dlga_mayor_war_description_2:mayor_war_description_3|The truth is, it is difficult to achieve a lasting success so far from Europe. Burning some villages and sinking a few ships is not that hard, but taking over an entire colony, that's normally beyond the abilities of a Viceroy, or a Governor General, what have you. Not to mention everyone is quickly up to gangband on whoever threatens to upset the balance of power. Often, a ruler will go to war when another realm provokes them. At such times, some hotheads at the court will demand retribution, and the authority of a ruler would suffer greatly were he to ignore the offense. I'm of course not talking about {s10}, as no one would ever question {reg4?her:his} authority.{***}
dlga_mayor_war_description_3:mayor_war_description_4|Mind you, we in the guild try to stay away from politics. But if {s10} were to ask for my humble advice, as a loyal subject, I would tell {reg4?her:him} that while {reg4?her:his} intent to rule over the Americas is perfectly reasonable, wars are bad for business -- and what is bad for business, is bad for the coffers of the realm.{***}
dlga_mayor_war_description_4:mayor_prepolitics|You may tell {s10} this if you ever meet {reg4?her:him}. No need to mention my name -- just say 'the people of {s4}' told you this. Our personal opinion, of course, as to what would be in {s10}'s best interests. None of us would ever dream of questioning a {reg4?her:his} decisions.{***}
dlga_mayor_prepolitics:mayor_political_questions|Did I mention that we here are all {s9}? Because I can't stress that enough... Anyway... Is there anything else?{***}
dlga_mayor_political_questions:mayor_politics_assess|What is {s10}'s policy in regards to the other powers in the Caribbean?{***}
dlga_mayor_politics_assess:mayor_politics_assess_realm|Which power did you have in mind?{***}
dlga_mayor_politics_assess_realm:mayor_politics_give_realm_assessment|{s11}{***}
dlga_mayor_politics_give_realm_assessment:mayor_prepolitics|{s14}{***}
dlga_mayor_political_questions:mayor_internal_politics|What can you say about the internal politics of the realms?{***}
dlga_mayor_internal_politics:mayor_internal_politics_2|Well, here in {s4} we are all united by our love for {s5} and support {reg4?her:his} claim to the rulership of the Americas. But I have heard some talk of internal bickering in other realms...{***}
dlga_mayor_internal_politics_2:mayor_internal_politics_3|The nobles in the colonies often have very different ideas about honor, strategy, and the way a nobleman should behave. In addition, they compete with each other for the ruler's favor, and are constantly weighing up their position -- how they stand, how their friends and family stand, and how their enemies stand.{***}
dlga_mayor_internal_politics_3:mayor_internal_politics_4|Underlying all the tensions is the possibility that a noble may abandon his liege, and pledge his services to another. In theory, each noble has sworn an oath to their ruler, but in practice, they oft find excuses to absolve themselves. The noble may claim that the ruler has failed to hold up his end of the bargain, to protect the noble and treat him justly. Or, the noble may claim that his ruler is in fact an usurper, and another has a better claim to rule.{***}
dlga_mayor_internal_politics_4:mayor_internal_politics_5|Rulers and governors still watch each other carefully. If a liege believes that a noble of his realm is going to change sides or rebel, he may indict the noble for treason and seize his properties. Likewise, if a noble fears that he will be indicted, he may rebel. Usually, whoever makes the first move will be able to control the governor's holdings.{***}
dlga_mayor_internal_politics_5:mayor_prepolitics|Now, men do not trust a noble who turns coat easily, nor do they trust a ruler who lightly throws around charges of treason. Those two factors can keep a realm together. But if relations between a noble and a liege deteriorate far enough, things can become very tense indeed... In other lands, of course. These things could never happen here in {s4}.{***}
dlga_mayor_political_questions:mayor_pretalk|That is all. Thank you.{***}
dlga_mayor_talk:mayor_economy_report_1|How is business in town?{***}
dlga_mayor_economy_report_1:mayor_economy_report_2|{s32}{***}
dlga_mayor_economy_report_2:mayor_economy_report_3|{s42}{***}
dlga_mayor_economy_report_3:mayor_pretalk|{s47}{***}
dlga_mayor_talk:mayor_wealth_comparison_1|How does the wealth of this city compare to the rest of the region?{***}
dlga_mayor_wealth_comparison_1:mayor_wealth_comparison_2|{s4} is considered the richest city in the Caribbean these days. Here in {s5}, we are poorer than {reg4} towns and more prosperous than {reg5}.{***}
dlga_mayor_wealth_comparison_2:mayor_wealth_comparison_3|Concerning the industry, {s4} is considered the most productive town in the region. Here in {s5}, we produce less than {reg4} towns, and more than {reg5}. Of course, production is affected by the supply of raw resources and the overall prosperity of the town.{***}
dlga_mayor_wealth_comparison_3:mayor_wealth_comparison_4|The hinterland of the town of {s4} is spoken of as the most prosperous in all the Americas. Here in {s5}, the surrounding villages produce less than the counryside around {reg4} towns, and more than {reg5}. Naturally, the wealth of a town's hinterland depends heavily on the tides of war. Looting and pillage make a massive impact.{***}
dlga_mayor_wealth_comparison_4:mayor_wealth_comparison_5|In terms of trade, the town of {s4} is believed to have received more caravans than any other over the past few months. Here in {s5}, we trade less than {reg4} towns, and more than {reg5}.{***}
dlga_mayor_wealth_comparison_5:mayor_pretalk|As for the public safety, the town of {s4} is said to be the most dangerous to the travelers. Here in {s5}, we are less plagued by outlaws and pirates than {reg4} towns, but {reg5} towns are considered safer than us.{***}
dlga_mayor_talk:mayor_investment_possible|I wish to buy land in this town for a productive enterprise.{***}
dlga_mayor_investment_possible:mayor_pretalk|You already operate a {s4} here. There probably aren't enough skilled tradesmen to start a second business.{***}
dlga_mayor_investment_advice:investment_choose_enterprise|A couple of things to keep in mind -- skilled laborers are always at a premium, so I doubt that you will be able to open up more than one business here. In order to make a profit for yourself, you should choose a commodity which is in relatively short supply, but for which the raw materials are cheap. What sort of enterprise would you like to start?{***}
dlga_investment_choose_enterprise:investment_summary|A mill and bakery, to make bread from grain.{***}
dlga_investment_summary:mayor_investment_confirm|Very good, sir. The land and the materials on which you may build your {s3} will cost you {reg7} piastres. Right now, your {s3} will produce {s4} worth {reg1} piastres each week, while the {s6} needed to manufacture that will be {reg2} and labor and upkeep will be {reg3}.{s9} I should guess that your profit would be {reg0} piastres a week. Of course, these numbers are speculative, providing that prices remain constant -- which, I assure you, they will not. Do you wish to proceed?{***}
dlga_mayor_investment_confirm:mayor_investment_purchase|Yes. Here is money for the land.{***}
dlga_mayor_investment_purchase:mayor_pretalk|Very good. Your business should be up and running in about a week. When next you come, speak to your {s4} about its operations.{***}
dlga_mayor_investment_confirm:mayor_pretalk|No, that's not unfeasible for me right now.{***}
dlga_investment_choose_enterprise:investment_summary.1|A brewery, to make ale from grain.{***}
dlga_investment_choose_enterprise:investment_summary.2|A tannery, to make leather from hides.{***}
dlga_investment_choose_enterprise:investment_summary.3|A wine press, to make wine from grapes.{***}
dlga_investment_choose_enterprise:investment_summary.4|An oil press, to make oil from olives.{***}
dlga_investment_choose_enterprise:investment_summary.5|An ironworks, to make tools from iron.{***}
dlga_investment_choose_enterprise:investment_summary.6|A weavery and dyeworks, to make velvet from silk and dye.{***}
dlga_investment_choose_enterprise:investment_summary.7|A weavery, to make wool cloth from wool.{***}
dlga_investment_choose_enterprise:investment_summary.8|A weavery, to make linen from flax.{***}
dlga_investment_choose_enterprise:mayor_pretalk|Nevermind.{***}
dlga_mayor_investment_possible:mayor_pretalk.1|{s9}{***}
dlga_mayor_investment_possible:mayor_investment_advice.1|Of course, {s0}. You are the governor of this town.{***}
dlga_mayor_investment_possible:mayor_investment|Well... Given your relationship with our governor, {s4}, I don't think many citizens would dare to sell you any land.{***}
dlga_mayor_investment_possible:mayor_pretalk.2|Well... Frankly speaking, we in the guild don't know you well enough. We can be very particular about outsiders coming in here and buying land.{***}
dlga_mayor_investment_possible:mayor_investment_advice.2|Very good, {s0}. We in the guild know and trust you, and I can surely find someone to sell you the land you need.{***}
dlga_mayor_talk:ms_talk_to_elder_to_construct|I'd like to discuss the development of the city.{***}
dlga_mayor_talk:oim_guild_master_talk|I'd like to talk trading.{***}
dlga_oim_guild_master_talk:oim_guild_master_ask|Yes, {playername}.{***}
dlga_oim_guild_master_ask:oim_send_caravan_generik_descr|What do I need a caravan for?{***}
dlga_oim_send_caravan_generik_descr:oim_guild_master_talk|Well, you can purchase a shipment of goods here for cheap, then send a caravan to another city to sell them for profit. Or not, if your skill at trading is lacking.{***}
dlga_oim_guild_master_ask:oim_send_caravan_generik|Yes, I'd like to send a caravan then.{***}
dlga_oim_send_caravan_generik:oim_send_caravan_which_goods|Which goods you wish to send with a caravan?{***}
dlga_oim_send_caravan_which_goods:oim_send_caravan_which_town|{s5} (cost: {reg0} piastres).{***}
dlga_oim_send_caravan_which_town:oim_send_caravan_town_selected|Where do you intend to ship the goods?{***}
dlga_oim_send_caravan_town_selected:oim_send_caravan_finish|{s1}{***}
dlga_oim_send_caravan_finish:oim_send_caravan_town_select_go_on4|Very well, {s1} it is. I estimate it would take {reg1} hours for the caravan to arrive. How many {s2} do you wish to ship?{***}
dlga_oim_send_caravan_town_select_go_on4:oim_send_caravan_town_select_go_on4b|Huge caravan ({reg0} piastres, shipping 20 units of goods).{***}
dlga_oim_send_caravan_town_select_go_on4b:oim_send_caravan_town_select_go_on4c|All right. Besides a caravan master himself, do you want any caravan guards escorting your goods?{***}
dlga_oim_send_caravan_town_select_go_on4c:oim_send_caravan_town_select_go_on5|{reg5} (cost: {reg0} piastres).{***}
dlga_oim_send_caravan_town_select_go_on5:close_window|All right, sounds just fine. {s2} will cost you {reg1} piastres.{***}
dlga_oim_send_caravan_town_select_go_on4:oim_send_caravan_town_select_go_on4b.1|Large caravan ({reg0} piastres, shipping 15 units of goods).{***}
dlga_oim_send_caravan_town_select_go_on4:oim_send_caravan_town_select_go_on4b.2|Medium caravan ({reg0} piastres, shipping 10 units of goods).{***}
dlga_oim_send_caravan_town_select_go_on4:oim_send_caravan_town_select_go_on4b.3|Small caravan ({reg0} piastres, shipping 5 units of goods).{***}
dlga_oim_send_caravan_town_select_go_on4:mayor_pretalk|{s2}{***}
dlga_oim_send_caravan_town_selected:mayor_pretalk|Some other time.{***}
dlga_oim_send_caravan_which_goods:mayor_pretalk|{s2}{***}
