dlga_start:member_chat|Not shown!{***}
dlga_lord_mercenary_elaborate_castle:lord_mercenary_elaborate_1.3|Only loyal nobles of {s10} can own lands and govern cities.You understand, a simple mercenary cannot be trusted with such responsibility.However, after serving for some time, you may earn the right to swear homage to {s10} and become a noble of the realm.Then you may be granted a settlement to govern.{***}
dlga_lord_request_mission_ask:lord_pretalk|You still haven't finished the last job I gave you, {playername}. You should be working on that, not asking me for other things to do.{***}
dlga_lord_request_mission_ask:lord_pretalk.1|I don't have any other jobs for you right now.{***}
dlga_lord_request_mission_ask:lord_tell_mission|A task?{***}
dlga_lord_tell_mission:lord_tell_mission_sworn_vassal|There are some minor errands which I need completed, but it would be more appropriate to give them to one of my own {reg65?servants:men}, not to {reg0?my lord:a noble of the realm}.{***}
dlga_lord_tell_mission_sworn_vassal:lord_pretalk|If you are looking for action against our foes, you may join our attack on {s4}. The enemy may come in force to oppose us, so it is good to have as many {reg65?soldiers:{soldiers/men}} as possible.{***}
dlga_lord_tell_mission_sworn_vassal:lord_pretalk.1|If you are looking for action against our foes, you may try venturing out to {s4}. We have received word that a force of {s5} is in the area, and I am going there myself. I cannot guarantee you that our enemies will be there when you arrive, of course.{***}
dlga_lord_tell_mission_sworn_vassal:lord_pretalk.2|If you are looking for action against our foes, you may try venturing out to {s4}. We have received word that a force of {s5} is in the area. I am not currently headed that way, but others may be. I cannot guarantee you that our enemies will be there when you arrive, of course.{***}
dlga_lord_tell_mission_sworn_vassal:lord_pretalk.3|If a worthy task presents itself, however, I may have a favor to ask of you at a later date.{***}
dlga_lord_tell_mission:destroy_lair_quest_brief|Yes, {playername}, there is something I need done. A group of {s4} has established a hideout somewhere in this area. They looted and burned several ships, and sometimes venture inland to prey on the roads as well. I need someone like you to find their lair and remove this menace.{***}
dlga_destroy_lair_quest_brief:merchant_quest_track_bandit_lair_choice|The raiders are likely to have laid up their ships in a well-concealed cove along the coastline. Find a group of them heading back to their base to resupply, and you can track them to the lair.{***}
dlga_merchant_quest_track_bandit_lair_choice:merchant_quest_destroy_lair_brief|Very well, I'll find them.{***}
dlga_merchant_quest_destroy_lair_brief:close_window|Good. We will await word of your success.{***}
dlga_merchant_quest_track_bandit_lair_choice:lord_pretalk|I'm afraid I can't pursue outlaws at the moment.{***}
dlga_destroy_lair_quest_brief:merchant_quest_track_bandit_lair_choice.1|These outlaws tend to hide their bases in the foothills, often near a spring. This gives them both water and concealment. Find a group of them heading back to their lair to resupply, and you can track them to the hideout.{***}
dlga_destroy_lair_quest_brief:merchant_quest_track_bandit_lair_choice.2|These pirates tend to hide their bases in the bays among the mountains, often placing lookouts high above where they have a view of the surrounding sea. This makes them difficult to surprise. Find a group of them heading back to their lair to resupply, and you can track them to the hideout.{***}
dlga_destroy_lair_quest_brief:merchant_quest_track_bandit_lair_choice.3|These robbers tend to hide their bases deep in the jungle, often in the middle of a swamp impassable for an outsider. Find a group of them heading back to their lair to resupply, and you can track them to the hideout.{***}
dlga_destroy_lair_quest_brief:merchant_quest_track_bandit_lair_choice.4|These freebooters tend to hide their bases in the coastal woodlands, where they have some concealment. Find a group of them heading back to their lair to resupply, and you can track them to the hideout.{***}
dlga_destroy_lair_quest_brief:merchant_quest_track_bandit_lair_choice.5|These brigands tend to hide their bases deep in the jungle. Find a group of them heading back to their lair to resupply, and you can track them to the hideout.{***}
dlga_lord_tell_mission:lord_mission_rescue_prisoner|My {s11}, {s13}, is held captive by {s14} of {s15}. Normally, honourable nobles treat the prisoners of equal rank as guests and grant them the privilege of parole, so long as they give their word of honour that they will not attempt to escape until their ransom is paid. But {s14} has consigned my {s11} to {reg3?her:his} prison, no doubt in the hope that {reg3?she:he} can bleed us dry.{***}
dlga_lord_mission_rescue_prisoner:lord_mission_rescue_prisoner_confirm|We need you to rescue my {s11} from captivity. You may be able to pay the ransom -- we could cover up to 5000 piastres of your expenses. If you have connections within {s24}, you may be able to use them to sneak {reg4?her:him} out. Or, you may try a more direct approach -- walk up to the warden, take the keys by force, and fight your way out. Can you do this for us?{***}
dlga_lord_mission_rescue_prisoner_confirm:lord_mission_rescue_prisoner_accepted|I can try.{***}
dlga_lord_mission_rescue_prisoner_accepted:lord_mission_rescue_prisoner_method|We are most grateful. May I ask how do you plan to proceed?{***}
dlga_lord_mission_rescue_prisoner_method:lord_mission_rescue_prisoner_method_ransom|I am thinking of paying the ransom.{***}
dlga_lord_mission_rescue_other_ideas:lord_mission_rescue_prisoner_method|Did you have any other ideas which you wished to discuss?{***}
dlga_lord_mission_rescue_prisoner_method:lord_mission_rescue_prisoner_method_prisonbreak|I am thinking of breaking in, finding {s13}, and getting out. Nothing too complex.{***}
dlga_lord_mission_rescue_prisoner_method_prisonbreak:lord_mission_rescue_prisoner_method_prisonbreak_2|I had discussed this idea with some of my men. You could enter {s24}, whether openly or by sneaking in disguise, walk up to the warden and take the keys by force. That's the easy part. Getting out is a different issue, though. The garrison may be slow to react, but even so, you are likely to find yourself fighting a half dozen or more enemies at once, with limited space in which to maneuver. If you can fight your way past them, though, you can probably get out.{***}
dlga_lord_mission_rescue_prisoner_method_prisonbreak_2:lord_mission_rescue_other_ideas|You may find it useful to create a distraction, to divert the attention of some of the garrison. If you have any friends in the villages near {s24}, this may be a time to put them to use.{***}
dlga_lord_mission_rescue_prisoner_method:lord_mission_rescue_prisoner_method_siege|I am thinking of besieging {s24}.{***}
dlga_lord_mission_rescue_prisoner_method_siege:lord_mission_rescue_other_ideas|Well, that is certainly the most direct approach.{***}
dlga_lord_mission_rescue_prisoner_method:lord_mission_rescue_prisoner_planning_end|I have done enough planning. Time to act!{***}
dlga_lord_mission_rescue_prisoner_planning_end:close_window|May the Lord protects you.{***}
dlga_lord_mission_rescue_prisoner_confirm:lord_mission_rescue_prisoner_rejected|I don't think that I can help you.{***}
dlga_lord_mission_rescue_prisoner_rejected:close_window|It would not have been an easy task. Perhaps we will find another way.{***}
dlga_lord_tell_mission:lord_mission_deliver_message|I need somebody to deliver a letter to {s13}, who is currently at {s4}.If you plan to be heading in that direction, would you carry my missive to {reg0?her:him}?The letter needs to be in {reg0?her:his} hands in 30 days.{***}
dlga_lord_mission_deliver_message:lord_mission_deliver_message_accepted|Certainly, I intend to pass by {s4} and will gladly take your letter with me.{***}
dlga_lord_mission_deliver_message_accepted:close_window|I appreciate it, {playername}. Here's the letter,and a small sum to cover your travel expenses. Give my regards to {s13} when you see him.{***}
dlga_lord_mission_deliver_message:lord_mission_deliver_message_rejected|I doubt I'll be seeing {s13} anytime soon, {s65}. You'd best send it with someone else.{***}
dlga_lord_mission_deliver_message_rejected:lord_pretalk|Ah, all right then. Well, I am sure I will find someone else.{***}
dlga_lord_mission_deliver_message:lord_mission_deliver_message_rejected_rudely|I am no errand {boy/girl}, {reg65?my lady:sir}. Hire a courier for your trivialities.{***}
dlga_lord_mission_deliver_message_rejected_rudely:lord_mission_deliver_message_rejected_rudely_2|Hm, is this how you respond to a polite requestfor a small favor? A poor show, {playername}. I didn't know you would take offence.{***}
dlga_lord_mission_deliver_message_rejected_rudely_2:lord_mission_deliver_message_rejected_rudely_3|Then you shall know better from now on.{***}
dlga_lord_mission_deliver_message_rejected_rudely_3:close_window|All right. I will remember that.{***}
dlga_lord_mission_deliver_message_rejected_rudely_2:lord_mission_deliver_message_accepted|Forgive my temper, {s65}. I'll deliver your letter.{***}
dlga_lord_tell_mission:lord_mission_deliver_message.1|I need somebody to deliver a letter to {s13} of {s15}, who is currently at {s4}.If you are going towards there, would you carry my missive to {reg0?her:him}? The letter needs to reach {reg0?her:him} in 40 days.{***}
dlga_lord_tell_mission:lord_mission_told|There is a fairly simple task I need to get done. My {s17} {s13} plans a visit to her relatives at {s14}.The journey has been postponed several times already with all the trouble on the high sea,but this time she is adamant about going. So, I want to make sure she's well-guarded on her way.I trust you well, {playername}, so I would be very grateful if you could escort her to {s14}and make sure she arrives safe and sound.{***}
dlga_lord_tell_mission:lord_mission_deal_with_bandits_told|A group of pirates overrun my village of {s15}.The scum have enslaved the settlers, plundering their farms and slaughtering their cattle.I wish I could personally lead a detachment to capture and hang the bastards,but I am too busy with the affairs of the state.{***}
dlga_lord_mission_deal_with_bandits_told:lord_mission_deal_with_bandits_accepted|Not a word more, I will head straight to {s15} and drive the outlaws out.{***}
dlga_lord_mission_deal_with_bandits_accepted:close_window|Will you? That's very helpful of you. Take this silver as a payment for your expenses.Make an example of those {s43}s.{***}
dlga_lord_mission_deal_with_bandits_told:lord_mission_deal_with_bandits_rejected|You shall have to find help elsewhere, I am too busy.{***}
dlga_lord_mission_deal_with_bandits_rejected:lord_pretalk|Ah... Too bad, forget I brought it up.{***}
dlga_lord_tell_mission:lord_tell_mission_raise_troops|It hurts me to admit, {playername}, but the quality of my recruits is appalling.There are men here who don't know which end of a pike to hold, let alone how to load a musket.{s43}You are renowned fighter, {playername}. Can you beat some knowledge of warfare into their heads?I would be grateful to you.{***}
dlga_lord_tell_mission_raise_troops:lord_tell_mission_raise_troops_2|How many men do you need?{***}
dlga_lord_tell_mission_raise_troops_2:lord_mission_raise_troops_told|If you can raise {reg1} {s14} and deliver to me, that will probably be enough.{***}
dlga_lord_mission_raise_troops_told:lord_mission_raise_troops_accepted|Of course, {s65}. Give me {reg1} fresh recruits and I'll train them to be {s14}.{***}
dlga_lord_mission_raise_troops_accepted:close_window|You've taken a weight off my shoulders, {playername}.I shall tell my lieutenant to assign the recruits to your company at once.Also, have some money to help with expenses. Here, this purse should do it.Thank you for your help.{***}
dlga_lord_mission_raise_troops_told:lord_mission_raise_troops_rejected|I am too busy these days to train anyone.{***}
dlga_lord_mission_raise_troops_rejected:lord_pretalk|Oh, of course. I had expected as much. Well, good luck to you then.{***}
dlga_lord_tell_mission:lord_mission_collect_taxes_told|You must know I am the governor of the {reg9?town:village} of {s3}.However, the matters of the state kept me away from my office, and it has been months since I had the taxes collected in there.Apparently the populace there has grown unruly lately and I need someone to go there and remind them oftheir obligations. And to... persuade them if they won't listen.If you go there and raise the taxes they owe me, I will grant you one-fifth of everything you collect.{***}
dlga_lord_mission_collect_taxes_told:lord_mission_collect_taxes_accepted|A fair offer, {s65}. We have an agreement.{***}
dlga_lord_mission_collect_taxes_accepted:close_window|Welcome news, {playername}.I will entrust this matter to you.Remember, those {reg9?townsmen:peasants} are cunning bastards, they will make every excuse to avoid paying their taxes.Do not let them fool you.{***}
dlga_lord_mission_collect_taxes_told:lord_mission_collect_taxes_rejected|Forgive me, I don't have the time.{***}
dlga_lord_mission_collect_taxes_rejected:lord_pretalk|Oh, yes. Well, good luck to you then.{***}
dlga_lord_tell_mission:lord_mission_hunt_down_fugitive_told|There is an issue I need someone to deal with. It concerns one {s4}, a well-known cutthroat and pirate.He has been at large for a while now, being accosted for a number of robberies and murders.I want the villain properly punished, so I've put a bounty of 300 piastres on his head.He is rumored to have kin at {s3}, and might have been gone in hiding with them.If you want to claim the bounty for yourself, find the bastard and make an example out of him.{***}
dlga_lord_mission_hunt_down_fugitive_told:lord_mission_hunt_down_fugitive_accepted|I will find him and execute the law.{***}
dlga_lord_mission_hunt_down_fugitive_accepted:close_window|Excellent, {playername}.I will be grateful to you, and so will the families of his victims.Naturally, the bounty will be yours. Good hunting to you.{***}
dlga_lord_mission_hunt_down_fugitive_told:lord_mission_hunt_down_fugitive_rejected|I am too busy to go after him at the moment.{***}
dlga_lord_mission_hunt_down_fugitive_rejected:lord_pretalk|As you wish, {playername}.I suppose there are plenty of bounty hunters around to get the job done . . .{***}
dlga_lord_tell_mission:lord_mission_told_kill_local_merchant|I have a certain... problem with one of the merchants here in {s3}.The insolent fool runs all over the place making a fuss that I dishonoured his daughter. What a wicked liar! Besides, she was asking for it.Still, he won't stop until he ruins my good reputation in the eyes of nobility and merchants alike.So, I want a trusted {man/woman} to make sure the bastard meets an unfortunate accident.{***}
dlga_lord_mission_told_kill_local_merchant:lord_mission_accepted_kill_local_merchant|Consider him having already slipped and fallen upon a tray full of knives, sir.{***}
dlga_lord_mission_accepted_kill_local_merchant:close_window|Very good. I trust in your skill and discretion,{playername}. Do not disappoint me.Go now and wait for my word, I'll send you a message telling when and where you can catch the merchant.Dispose of him, and I shall reward you generously.{***}
dlga_lord_mission_told_kill_local_merchant:lord_mission_rejected|I'm no murderer, sir. Find someone else for your dirty job.{***}
dlga_lord_tell_mission:lord_mission_told_meet_spy_in_enemy_town|There is a task I need to be done, {playername}, and I need a loyal and discrete person to handle it. You see, there is an agent of mine in {s13}, to keep an eye on our enemies and report anything that might warrant my attention. Every week I send someone to collect the spy's reports and deliver them to me. You can take this job if you want to.{***}
dlga_lord_mission_told_meet_spy_in_enemy_town:quest_meet_spy_in_enemy_town_accepted|I just love playing secret agents. Count me in.{***}
dlga_quest_meet_spy_in_enemy_town_accepted:quest_meet_spy_in_enemy_town_accepted_response|Excellent! Ride swiftly to {s13}, the spy is waiting.{***}
dlga_quest_meet_spy_in_enemy_town_accepted_response:quest_meet_spy_in_enemy_town_accepted_2|But {s13} is strongly garrisoned. How can I get there without being attacked?{***}
dlga_quest_meet_spy_in_enemy_town_accepted_2:quest_meet_spy_in_enemy_town_accepted_response|You shall have to stay unnoticed. Avoid enemy fortresses, villages and patrols. Do not bring a large band of soldiers along. If you fail to sneak at first, give it a while for the garrison to lower its guard again, or you may have a difficult time infiltrating the town.{***}
dlga_quest_meet_spy_in_enemy_town_accepted_response:quest_meet_spy_in_enemy_town_accepted_3|How will I recognise the spy?{***}
dlga_quest_meet_spy_in_enemy_town_accepted_3:quest_meet_spy_in_enemy_town_accepted_response|Once you get to {s13}, talk to the locals, the spy is one of them. If you think you've found the spy, say the words, '{s11}' The spy will respond with the words '{s12}' Thus you will know one another, and {reg7?she:he} will give you {reg7?her:his} reports.{***}
dlga_quest_meet_spy_in_enemy_town_accepted_response:quest_meet_spy_in_enemy_town_accepted_4|What's in it for me?{***}
dlga_quest_meet_spy_in_enemy_town_accepted_4:quest_meet_spy_in_enemy_town_accepted_response|Look, I have plenty of silver in my coffers for loyal {men/women} like you. Do well by me, {playername}, and you'll rise high.{***}
dlga_quest_meet_spy_in_enemy_town_accepted_response:quest_meet_spy_in_enemy_town_accepted_end|I know what to do. Farewell, my lord.{***}
dlga_quest_meet_spy_in_enemy_town_accepted_end:lord_pretalk|Safe journey, {playername}. Remember, the secret phrase is '{s11}' The counterphrase is '{s12}' Bring any reports back to me, and I'll compensate you for your trouble.{***}
dlga_lord_mission_told_meet_spy_in_enemy_town:quest_meet_spy_in_enemy_town_rejected|I must decline. I am not into this cloak-and-dagger stuff.{***}
dlga_quest_meet_spy_in_enemy_town_rejected:lord_pretalk|As you wish, {playername}, but I suggest you to forget anything I told you about any spies. They do not exist, have never existed, and no one will ever find them. You'll do well by remembering that.{***}
dlga_lord_tell_mission:lord_mission_told_raid_caravan_to_start_war|I am sick of bowing and scraping to {s13}, {playername}. We've tolerated these bastards for far too long.We must strike them now, before they got too strong while we lax.Too bad some cowards keep bending over to them, and block any kind of action.These traitors must be on their payroll for sure!{***}
dlga_lord_mission_told_raid_caravan_to_start_war:lord_mission_tell_raid_caravan_to_start_war_2|That's true, {s65}, but what can be done about it?{***}
dlga_lord_mission_tell_raid_caravan_to_start_war_2:lord_mission_tell_raid_caravan_to_start_war_3|Finally, someone with a stomach for action.Something can be done, as a matter of fact. If we cannot make our nobles march out, we just might make theirs.All we need is to send a detachment to their lands, pillage some caravan of theirs or raze a village.And make sure they know {s14} is to blame. Then they'll be up in arms in no time.And then, well, even the cowards among us will have to defend themselves.So, what say you? Are you in mind for some good old provocation?{***}
dlga_lord_mission_tell_raid_caravan_to_start_war_3:quest_raid_caravan_to_start_war_accepted|A splendid idea. I'm in.{***}
dlga_quest_raid_caravan_to_start_war_accepted:close_window|Very good!Plunder a caravan, or attack a village of theirs, that should do the trick.Good hunting. May the borders burn!{***}
dlga_lord_mission_tell_raid_caravan_to_start_war_3:lord_mission_tell_raid_caravan_to_start_war_4|Why don't you do that yourself?{***}
dlga_lord_mission_tell_raid_caravan_to_start_war_4:lord_mission_tell_raid_caravan_to_start_war_5|Well, {playername}, I am not too well-liked among the nobility of our colonies. If I start a war against their wishes, they'll have my head on a pike.But you, you are liked and not maligned much. You might get away with it whereas I would get crucified.Naturally, I will back you up and defend your actions against your opponents in every way I can.Sure, a few cowardly nobles might be upset at your actions, but I am sure you'll survive that.{***}
dlga_lord_mission_tell_raid_caravan_to_start_war_5:quest_raid_caravan_to_start_war_accepted|That seems reasonable. I am willing to do this.{***}
dlga_lord_mission_tell_raid_caravan_to_start_war_5:quest_raid_caravan_to_start_war_rejected_2|I don't like this. Find yourself someone else to take the blame for your schemes.{***}
dlga_quest_raid_caravan_to_start_war_rejected_2:lord_pretalk|Hm. As you wish, {playername}.I thought you had some fire in you, but it seems I was wrong.{***}
dlga_lord_mission_told_raid_caravan_to_start_war:quest_raid_caravan_to_start_war_rejected_1|I can't agree with you, sir. Better a lean peace than a fat victory.{***}
dlga_quest_raid_caravan_to_start_war_rejected_1:lord_pretalk|Not so brave, after all? This precious peace of yours won't last for long, believe me.{***}
dlga_lord_tell_mission:lord_mission_told.1|Well, some of the slaves working my plantations near {s4} have run away. The ungrateful swine,I give them food and the roof above their heads, and this is how they repay me!From what I've been hearing, they're running to {s3} as fast as they can,and have split up into three groups to try and avoid capture.I want you to capture all three groups and fetch them back to {s4} by whatever means necessary.I should really have them hanged for attempting to escape, but we need hands for the upcoming harvest,so I'll let them go off this time with a good flogging.{***}
dlga_lord_tell_mission:lord_tell_mission_follow_spy|An enemy spy has been skulking in this town for a while.I'd have him tortured and hanged in no time, of course, but I want to trace him back to his master.My contacts have discovered the spy is about to have a rendezvous with whoever sent him.I want them both captured and delivered into my hands.{***}
dlga_lord_tell_mission_follow_spy:lord_tell_mission_follow_spy_2|Here's what I want you to do - wait here until the spy leaves town, then follow him to the meeting place.You must take absolute care not to be seen by the spy on your way, else he may suspect foul play and turn back.When the master appears, attack the pair on spot, take them alive and bring them back to me.{***}
dlga_lord_tell_mission_follow_spy_2:lord_tell_mission_follow_spy_accepted|I'll do it, {s65}.{***}
dlga_lord_tell_mission_follow_spy_accepted:close_window|Good, I'm sure you'll do a fine job of it. I'll send a messenger to point you at the spy once he leaves,so you will know whom to follow. Remember, I want them both, and I want them alive.{***}
dlga_lord_tell_mission_follow_spy_2:lord_tell_mission_follow_spy_rejected|No, this skulking is not for me.{***}
dlga_lord_tell_mission_follow_spy_rejected:lord_pretalk|A shame. Well, carry on as you were, {playername}...{***}
dlga_lord_tell_mission:lord_tell_mission_capture_enemy_hero|There is a job I need done, {playername}. A difficult job, but you may be just the kind of person who can pull it off.A relative of mine is held captive by {s13}, and I can spare no funds to ransom him.So, I need someone to take one of their own nobles prisoner, and deliver him to me to be used as a bargain chip.Naturally, any noble of {s13} is likely to be surrounded by a retinue of bodyguards at all times.Can you handle that?{***}
dlga_lord_tell_mission_capture_enemy_hero:lord_tell_mission_capture_enemy_hero_accepted|Consider it done, {s65}.{***}
dlga_lord_tell_mission_capture_enemy_hero_accepted:close_window|That's a spirit! Go and bring me one of our enemies,and your name will be toasted throughout my palace when you return! The reward will be worth your efforts, of course...{***}
dlga_lord_tell_mission_capture_enemy_hero:lord_tell_mission_capture_enemy_hero_rejected|Afraid not, {s65}. Sounds too dangerous, not to mention dishonourable.{***}
dlga_lord_tell_mission_capture_enemy_hero_rejected:lord_pretalk|Clearly you lack the mettle I had thought you possessed. Very well, {playername}, I will find someone else.{***}
dlga_lord_tell_mission:lord_tell_mission_lend_companion|I don't have any tasks you could help me with for now. However, I could use the skills of one of your officers, {s3}.Can you lend me {reg3?her:his} services for a while?{***}
dlga_lord_tell_mission_lend_companion:lord_tell_mission_lend_companion_2|How long will you be needing {reg3?her:him}?{***}
dlga_lord_tell_mission_lend_companion_2:lord_mission_lend_companion_told|Just a few days, a week at most.{***}
dlga_lord_mission_lend_companion_told:lord_tell_mission_lend_companion_accepted|Very well then, {s3} may stay with you for one week.{***}
dlga_lord_tell_mission_lend_companion_accepted:close_window|I am most grateful, {playername}. I will release your officer back to you with due haste.{***}
dlga_lord_mission_lend_companion_told:lord_tell_mission_lend_companion_rejected|I am sorry, but I need {s3} with me.{***}
dlga_lord_tell_mission_lend_companion_rejected:lord_pretalk|That's very unfortunate, but I guess I cannot force you or {s3} to agree.I shall have to make do without.{***}
