dlga_start:member_chat|Not shown!{***}
dlga_quest_meet_spy_in_enemy_town_completed:quest_meet_spy_in_enemy_town_completed_2|I have the reports.{***}
dlga_quest_meet_spy_in_enemy_town_completed_2:lord_pretalk|An actually competent aide, how unusual in these dark times. Here is the payment I promised you.{***}
dlga_lord_start:lord_pretalk|Excellent, {playername}! The nobles of {s13} are marching for war as we speak!Soon we shall reap the fruit of our labor, from fields ripe for plunder.This war is going to make us rich, mark my words!{***}
dlga_lord_start:lord_collect_debt_completed|I heard you've managed to collect the debt {s7} owed to me. Good, it's past time I had it back.I promised to give you a fifth of it all, did I not?That makes {reg3} piastres, so if you give me my share -- that's {reg4} piastres -- you can keep the rest.{***}
dlga_lord_collect_debt_completed:lord_collect_debt_pay|Of course, {s65}. {reg4} piastres, all here.{***}
dlga_lord_collect_debt_pay:lord_pretalk|I am pleasantly surprised, {playername}. Frankly, I had long lost my hope of ever seeing this silver again.Please accept my sincere thanks along with your portion of it.{***}
dlga_lord_collect_debt_completed:lord_collect_debt_no_pay|Sir... I fear I don't have the money with me at the moment.{***}
dlga_lord_collect_debt_no_pay:close_window|Are you kidding?I know full well that {s7} gave you the money. I want every piastre owed to me, {sir/madam}, and I want it yesterday.For now, I hold you personally in my debt until I see that silver.{***}
dlga_lord_start:close_window.1|Hah, I heard that worm-tongued father of a worthless slut has met an unfortunate accident. How... unfortunate.I am glad to see you're not afraid to get your hands dirty. This is a quality I appreciate much, it will take you far.Here's your reward. Remember, {playername}, stick with me and we'll go a long, long way together.{***}
dlga_lord_start:close_window.2|Oh, it's you. So tell me again, how exactly does one get disarmed and beaten by a weak, old trader?What kind of incompetent wimp are you?Get out from my sight, {playername}. I still have an accident to arrange.{***}
dlga_lord_start:lord_kill_local_merchant_let_go|Are you deaf or just stupid, {playername}? What part of 'unfortunate accident' did you not get? Where does 'give him a sermon and pat him on the back' fit in?{***}
dlga_lord_kill_local_merchant_let_go:lord_kill_local_merchant_let_go_2|Sir, I made sure he will not raise his voice against you again.{***}
dlga_lord_kill_local_merchant_let_go_2:lord_pretalk|I don't care. I wanted him dead, not chastised. I pray for your sake he does as you say, or you'll both regret it.This is half the money I promised you. Don't say a word, {playername}, you're lucky to get even that.I have little use for {men/women} who cannot follow orders.{***}
dlga_lord_start:lord_follow_spy_completed|Impressive, {playername}! You brought both the spy and {reg0?her:his} master in chains,and they are now safely locked in my prison, waiting for a blind date with my torturer.I'm very pleased with your success, and I give you this purse as a token of my appreciation.{***}
dlga_lord_follow_spy_completed:lord_pretalk|Thank you, {s65}.{***}
dlga_lord_start:lord_follow_spy_half_completed|Damn you, {playername}! I wanted TWO prisoners -- the spy alone is next to useless to me,it was his master I wanted captured.Half a job gets you half a reward. Take it and begone from my sight.{***}
dlga_lord_follow_spy_half_completed:lord_pretalk|I did my best, {s65}.{***}
dlga_lord_start:lord_follow_spy_half_completed.1|I wanted two prisoners, {playername}, not one. Two. At least it was the spy's master you have captured,the one I wanted caught most. The spy will never return here, and will prove quite useless towhatever lord {reg0?she:he} served. 'Tis better than nothing.However, you'll understand if I pay you half the promised reward for what is but half a success.{***}
dlga_lord_start:lord_follow_spy_failed|{playername}, can you ever accomplish anything in your pitiful life?Failing to capture both the spy AND {reg0?her:his} master gives the word 'failure' a new meaning.Forget any reward I offered you. You've done nothing to earn it.{***}
dlga_lord_follow_spy_failed:lord_pretalk|Hrm. As you like, {s65}.{***}
dlga_lord_start:lord_generic_mission_completed.2|Splendid work, {playername}. The slaves are back, properly flogged, and they're busy on the plantation as we speak.You certainly earned your reward. Here, take it, with my compliments.{***}
dlga_lord_start:lord_bring_back_runaway_serfs_failed|{playername}. I have been waiting patiently for my slaves, yet none have returned. Have you an explanation?Were you outwitted by the stupid livestock, or are you merely incompetent?Or perhaps you are plotting with my enemies, intending to ruin me...{***}
dlga_lord_bring_back_runaway_serfs_failed:lord_bring_back_runaway_serfs_failed_1a|Forgive me, {s65}, those slaves are slippery as eels.{***}
dlga_lord_bring_back_runaway_serfs_failed_1a:lord_pretalk|Hmph, that is not an excuse for failure, {playername}.Now if you will excuse me, I need to purchase new men to work these plantations before the harvest goes bad.{***}
dlga_lord_bring_back_runaway_serfs_failed:lord_bring_back_runaway_serfs_failed_1b|Perhaps you should have treated them better...{***}
dlga_lord_bring_back_runaway_serfs_failed_1b:close_window|Hah, now you reveal your true colours, traitor! Your words match your actions all too well. I should never have trusted you.{***}
dlga_lord_start:lord_runaway_serf_half_completed|You disappoint me, {playername}. There were three groups of slaves that I charged you to return. Three. Not {reg17}.I suppose the ones who did come back shall have to work twice as hard to make up for those that got away.As for your reward, {playername}, I'll only pay you for the slaves you returned, not the ones you let fly.Here. Take it, and let this business be done.{***}
dlga_lord_runaway_serf_half_completed:lord_pretalk|Thank you, {s65}. You are indeed generous.{***}
dlga_lord_runaway_serf_half_completed:lord_pretalk.1|Bah, this proved to be a waste of my time.{***}
dlga_lord_start:lord_deal_with_bandits_completed|{playername}, I was told my village of {s5} had been relieved an the outlaw gang occupying it. I am most grateful.I hope these {reg14} piastres will be an adequate compensation for your trouble.{***}
dlga_lord_deal_with_bandits_completed:lord_pretalk|Not a problem, {s65}.{***}
dlga_lord_deal_with_bandits_completed:lord_pretalk.1|Glad to be of service.{***}
dlga_lord_deal_with_bandits_completed:lord_pretalk.2|It was mere child's play.{***}
dlga_lord_start:lord_pretalk.1|Damn it, {playername}. I heard the pirates preying on my village of {s5} have kicked you high and wide. The village lies in ruins now, thanks to your intervention.Everyone said that you were a capable warrior, but appearently, they were wrong.{***}
dlga_lord_start:lord_deliver_cattle_to_army_thank|Ah, {playername}. My quartermaster has informed me of your delivery, {reg13} heads of cattle, as I requested. I'm impressed.{***}
dlga_lord_deliver_cattle_to_army_thank:lord_pretalk|Not a problem, {s65}.{***}
dlga_lord_deliver_cattle_to_army_thank:lord_pretalk.1|Glad to be of service.{***}
dlga_lord_deliver_cattle_to_army_thank:lord_pretalk.2|Mere child's play.{***}
dlga_lord_start:lord_scout_waypoints_thank|You make a good scout, {playername}. My courier just delivered me your reports on {s13}, {s14} and {s15}. Good job.{***}
dlga_lord_scout_waypoints_thank:lord_pretalk|A simple task, {s65}.{***}
dlga_lord_scout_waypoints_thank:lord_pretalk.1|Nothing I couldn't handle.{***}
dlga_lord_scout_waypoints_thank:lord_pretalk.2|My pleasure, {s65}.{***}
dlga_lord_start:lord_mission_told_deliver_cattle_to_army|{playername}, we have a problem with supplies. A few days more, and the army will begin to starve. I need you to bring us {reg3} heads of cattle so I can keep the soldiers fed. I don't care where and how do you get the cattle from, just deliver it to the army.{***}
dlga_lord_mission_told_deliver_cattle_to_army:lord_mission_told_deliver_cattle_to_army_accepted|I will bring some cattle, sir.{***}
dlga_lord_mission_told_deliver_cattle_to_army_accepted:close_window|Excellent! Make it so, {playername}. We need that cattle, and we need it now.{***}
dlga_lord_mission_told_deliver_cattle_to_army:lord_mission_told_deliver_cattle_to_army_rejected|Sorry, sir, I have other plans.{***}
dlga_lord_mission_told_deliver_cattle_to_army_rejected:close_window|That... is unfortunate, {playername}. I shall have to find someone else who's up to the task. Please go now, I've work to do.{***}
dlga_lord_start:lord_pretalk.2|Thank you for arriving so speedily, {playername}. However, we've already brokered peace and do not need your services in the standing army. You may attend to your other business now.{***}
dlga_lord_start:lord_report_to_army_asked|Ah, you have arrived at last, {playername}. About time. I hope you have enough soldiers with you?{***}
dlga_lord_report_to_army_asked:lord_report_to_army_completed|I have a company of good, hardened soldiers with me. We are ready to join you.{***}
dlga_lord_report_to_army_completed:close_window|Excellent. We'll be on the march soon. I trust you will do what is necessary to support our campaign. I do not require you to stay close by, and I will not count it against you if you believe that your forces would serve us better away from our camp. But if you do choose to remain with me and support me in battle, that would be appreciated. I may also have additional assignments for you.{***}
dlga_lord_report_to_army_asked:lord_report_to_army_continue|I don't have the sufficient number of troops yet. I will need some more time.{***}
dlga_lord_report_to_army_continue:close_window|Hurry up, then. We'll be marching out soon, and I need every able hand we can muster.{***}
dlga_lord_start:lord_mission_told_scout_waypoints|{playername}, I need someone to reconnoiter the area in front of our army. We're sorely lacking on information,and I need to know of any signs of enemy activity before we may proceed.I want you to go to {s13}, {s14} and {s15}, then report back on whatever you may find.{***}
dlga_lord_mission_told_scout_waypoints:lord_mission_told_scout_waypoints_accepted|I'll scout ahead, sir.{***}
dlga_lord_mission_told_scout_waypoints_accepted:close_window|Good {man/lass}! Then hurry to {s13}, {s14} and {s15} and check out what's around. Make a note of anything you find and get back to me as soon as possible.{***}
dlga_lord_mission_told_scout_waypoints:lord_mission_told_scout_waypoints_rejected|I'm afraid I can't do that.{***}
dlga_lord_mission_told_scout_waypoints_rejected:lord_pretalk|That's mighty disappointing, {playername}. Mighty disappointing. We'll talk later, I need to find my scout.{***}
dlga_lord_start:lord_pay_debt_2|I believe you owe me {reg1} piastres, {playername}. Do you intend to pay your debt anytime soon?{***}
dlga_lord_pay_debt_2:lord_pay_debt_3_1|That is why I came, {s65}. Here it is, every piastre I owe you.{***}
dlga_lord_pay_debt_3_1:lord_pretalk|Ah, excellent. You are a {man/woman} of honour, {playername}. I am satisfied. Your debt to me has been paid in full.{***}
dlga_lord_pay_debt_2:lord_pay_debt_3_2|Alas, I don't have sufficient funds, {s65}. But I'll pay you soon enough.{***}
dlga_lord_pay_debt_3_2:lord_pretalk|Well, don't keep me waiting much longer.{***}
dlga_lord_start:lord_start.1|By the way, I hope you get a chance to meet my {s11}, {s14}.{***}
dlga_lord_start:lord_start.2|By the way, I am sure that my {s11}, {s14}, would be delighted were you to pay {reg0?her:him} a visit. {reg0?She:He} awaits you in {reg0?her:his} chambers.{***}
dlga_lord_start:lord_buy_prisoner|I heard that you have taken our enemy {s3} captive and {reg0?she:he} is with your party at the moment.I could pay you {reg6} piastres if you want to get rid of {reg0?her:him}. I longed to see {reg0?her:him} in my prison for a long, long time...You can wait for {reg0?her:his} family to pay {reg0?her:his} ransom, of course, but there is no telling how long that will take, eh?{***}
dlga_lord_buy_prisoner:lord_buy_prisoner_accept|Sounds good to me. I'll leave {s3} as your toy for {reg6} piastres.{***}
dlga_lord_buy_prisoner_accept:lord_pretalk|Excellent! Here's your {reg6} piastres.I'll send some men to drag him to my prison with due haste.{***}
dlga_lord_buy_prisoner:lord_buy_prisoner_deny|I am afraid your offer sounds questionable.{***}
dlga_lord_buy_prisoner_deny:lord_pretalk|Most unfortunate. He's your prisoner, {playername}, but you'll not get a better offer. Take it from me.{***}
dlga_lord_start:lord_talk|I lift a {s5} to your health, {playername}! You are most gracious to host us on this occasion. Now, what is it?{***}
dlga_lord_start:lord_talk.1|To your health, {sir/your Highness}. Long may you reign. What is your bidding?{***}
dlga_lord_start:lord_talk.2|What is your bidding?{***}
dlga_lord_start:lord_talk.3|I wish to welcome you to my palace on this auspicious occasion. Now, what is it?{***}
dlga_lord_start:lord_talk.4|Let us lift a {s5} to the health of our host, {s4}. Now, what is it?{***}
dlga_lord_start:close_window.3|I received the gift, presented to me through my {s11} {s10}. It was a noble gesture, {s0}, and I regret that we ever quarreled.{***}
dlga_lord_start:close_window.4|I received the gift, presented to me through my {s11} {s10}. For {reg4?her:his} sake, I am willing to let bygones be bygones.{***}
dlga_lord_start:close_window.5|I received the gift, presented to me through my {s11} {s10}. Bah! Do you think you can buy my friendship?{***}
dlga_lord_start:close_window.6|I received the gift, presented to me through my {s11} {s10}. As dear as {reg4?she:he} is to me, however, I cannot forget our differences.{***}
dlga_lord_start:lord_talk.5|So what do you want now?{***}
dlga_lord_wedding_reschedule:lord_return_dower|I have serious doubts that this wedding will be ever concluded. Please return my dower.{***}
dlga_lord_return_dower:close_window|Well, that is your right, if you indeed have no confidence in our family's commitments. Take your money.{***}
dlga_start:lord_start.1|My {lord/lady}, if you wish to marry, we can proceed to the ball at {s4} to exchange vows before the nobles of the realm.{***}
dlga_start:lord_start.2|My {lord/lady}, I grow tired of waiting for the nobles of this realm to assemble. Come with me to {s4} exchange our vows.{***}
dlga_start:lord_start.3|My {lord/lady}, I grow tired of waiting for the nobles of this realm to assemble. Perhaps we should take the first opportunity to marry, in any church that is open to us.{***}
dlga_start:lord_groom_vows|My {lord/lady}, I have grown tired of waiting. Let us proceed with the vows immediately.{***}
dlga_lord_groom_vows:female_pc_marriage_vow|My {lord/lady}, with this assembly as my witness, I vow to take you as my {husband/wife}, to honor, cherish, and {obey/protect} you. My the Lord blesses us with health, prosperity, and children.{***}
dlga_female_pc_marriage_vow:lord_groom_wedding_complete|I vow to take you as my {wife/husband}.{***}
dlga_lord_groom_wedding_complete:close_window|We are now husband and wife. Let the festivities commence!{***}
dlga_female_pc_marriage_vow:close_window|Wait -- I need to think about this.{***}
dlga_start:lord_groom_vows.1|My {lord/lady}, my eyes rejoice to see you. We may proceed with the vows.{***}
dlga_start:close_window.10|Very well. You've made your point. I have nothing more to say.{***}
dlga_start:close_window.11|Well, {sir/my lady}! Please, do not trouble yourself to rise from the ground, as I would simply have to knock you down again. I shall take your silence as an apology. Good day to you.{***}
dlga_start:close_window.12|Very well. You've made your point. I retract what I said. I hope you have obtained satisfaction.{***}
dlga_start:close_window.13|Hah! Not so gallant now, are we? Now trouble me no more.{***}
dlga_start:close_window.14|Very well -- you have won. Let all those present today witness that you have defeated me, and I shall abandon my suit of {s10}. Are you satisfied, you heartless {bastard/bitch}?{***}
dlga_start:close_window.15|Get up. Let all those present today witness that I have defeated you, and you are now bound to relinquish your suit of the {s10}. I will permit you one final visit, to make your farewells. After that, if you persist in attempting to see {reg0?her:him}, everyone shall know that you are a {man/woman} of scant honor.{***}
dlga_start:player_siege_castle_commander_1|What do you want?{***}
dlga_player_siege_castle_commander_1:player_siege_ask_surrender|Open the gates and surrender the fortress!{***}
dlga_player_siege_ask_surrender:player_siege_ask_surrender_treatment|Do you swear on your honour that no harm will come to us?{***}
dlga_player_siege_ask_surrender_treatment:player_siege_ask_surrender_treatment_reject|I swear nothing. Lay down your arms, lest we slaughter you to the last man!{***}
dlga_player_siege_ask_surrender_treatment_reject:close_window|{Bastard/Bitch}. We will fight you till the last drop of blood!{***}
dlga_player_siege_ask_surrender_treatment:player_siege_ask_surrender_treatment_accept|You will be ransomed and your soldiers will be spared. That I can promise.{***}
dlga_player_siege_ask_surrender_treatment_accept:close_window|Very well. Then I offer you my surrender.{***}
dlga_player_siege_ask_surrender:player_siege_ask_leave_unmolested|We will surrender this city and march out if you swear by the Lord you'll let us leave unmolested.{***}
dlga_player_siege_ask_leave_unmolested:player_siege_ask_leave_unmolested_accept|You have my word. You can leave the fortress freely, we will not attack you.{***}
dlga_player_siege_ask_leave_unmolested_accept:close_window|Very well. Then we surrender the city to you. You have won this day, but we'll meet again.{***}
dlga_player_siege_ask_leave_unmolested:player_siege_ask_leave_unmolested_reject|Not a chance. I want prisoners.{***}
dlga_player_siege_ask_leave_unmolested_reject:close_window|Then we will defend the fortress to death. This parley is done, farewell.{***}
dlga_player_siege_ask_surrender:close_window|{s0} will never surrender {s1}!{***}
dlga_player_siege_ask_surrender:close_window.1|Surrender? You are kidding, right? I can hold these walls for years to come!{***}
dlga_player_siege_castle_commander_1:close_window|Nothing. I'll leave you now.{***}
dlga_start:freed_lord_answer|I owe it to you for releasing me, friend.{***}
dlga_freed_lord_answer:freed_lord_answer_1|Not so fast, 'friend'. You're my prisoner now.{***}
dlga_freed_lord_answer_1:close_window|Oh... Someday, I'll make you sorry about this, {bastard/bitch}!{***}
dlga_freed_lord_answer:freed_lord_answer_2|You are free to go wherever you want, sir.{***}
dlga_freed_lord_answer_2:close_window|Thank you, good {sir/lady}. I never forget someone who's done me a good turn.{***}
dlga_start:defeat_lord_answer|{s43}{***}
dlga_defeat_lord_answer:defeat_lord_answer_1|You are my prisoner now.{***}
dlga_defeat_lord_answer_1:close_window|You have won the day.{***}
dlga_defeat_lord_answer:defeat_lord_answer_2|You impressed me in the battle. You can go freely.{***}
dlga_defeat_lord_answer_2:close_window|{s43}{***}
dlga_start:party_encounter_lord_hostile_attacker|{playername}!{***}
dlga_party_encounter_lord_hostile_attacker:party_encounter_lord_hostile_attacker|{s42}{***}
dlga_party_encounter_lord_hostile_attacker:party_encounter_lord_hostile_attacker_2|{s43}{***}
dlga_start:party_encounter_lord_hostile_attacker.1|Halt!{***}
dlga_start:lord_requests_recruitment|{s9}{***}
dlga_lord_requests_recruitment:close_window|{s9}{***}
dlga_lord_requests_recruitment:lord_requests_recruitment_refuse|{s9}{***}
dlga_lord_requests_recruitment_refuse:close_window|{s9}{***}
dlga_start:supported_pretender_talk|I am listening, {playername}.{***}
dlga_start:pretender_intro_1|I do not think we were properly introduced.{***}
dlga_pretender_intro_1:pretender_intro_2|I am {playername}. Honored to serve you.{***}
dlga_pretender_intro_2:pretender_intro_3|{s48}{***}
dlga_pretender_intro_3:pretender_rebellion_cause_1|I thought {s12} was led by {s11}?{***}
dlga_pretender_rebellion_cause_1:pretender_rebellion_cause_2|{s48}{***}
dlga_pretender_rebellion_cause_2:pretender_rebellion_cause_3|{s48}{***}
dlga_pretender_rebellion_cause_3:pretender_start|{s48}{***}
dlga_pretender_start:pretender_rebellion_cause_prelim|Tell me your story again, {reg65?my lady:sir}?{***}
dlga_pretender_rebellion_cause_prelim:pretender_rebellion_cause_1|Very well, I shall.{***}
dlga_pretender_start:pretender_discuss_rebellion_1|Your cause sounds just and your intentions reasonable. I want to help you seize what is yours!{***}
dlga_pretender_discuss_rebellion_1:pretender_discuss_rebellion_2a|Reclaiming what is rightfully mine will be no easy matter, {playername}.All the nobles have sworn oaths of loyalty to {s11}.Some of them, of course, might eventually side with us if they believe our cause is either just or profitable for them,but we are looking towards months and years of hard struggle, nonetheless.Are you sure you are up to the task, {playername}?{***}
dlga_pretender_discuss_rebellion_2a:pretender_discuss_rebellion_2|{s11}{***}
dlga_pretender_discuss_rebellion_2:pretender_discuss_rebellion_3|I am ready for this struggle.{***}
dlga_pretender_discuss_rebellion_3:close_window|Your eagerness to join my cause is admirable, {playername}, and I am grateful to you for it.But for now, there is little you could do for me.Were you to gain renown as a soldier and a leader of men, then our friends would not hesitate to join our cause,and our enemies would be wary to take up arms against us. When that time comes, I will come with you gladly.But until that time, it is wiser not to openly challenge the usurper, {s11}.{***}
dlga_pretender_discuss_rebellion_3:close_window.1|Haven't you already taken up the cause of {s17}?You must have a very strong sense of justice, indeed.But no, thank you. I will not be part of your game.{***}
dlga_pretender_discuss_rebellion_3:close_window.2|{playername}, you are already oath-bound to serve {s15}.As such, I cannot allow you to take up my cause, and let my enemies claim that I am but a mere puppet of {s16}.No, if I am to be a leader of my people, I must achieve it due to the righteousness of my cause and the support of my subjects alone.If you want to help me, you must first free yourself of your service to {s15}.{***}
dlga_pretender_discuss_rebellion_3:close_window.3|You are a monarch in your own right, {sir/my lady}. If you were to back me, I would be merely your puppet.{***}
dlga_pretender_discuss_rebellion_3:pretender_rebellion_ready|You are a capable warrior, {playername}, and I am sure with your renown as a commander, and my righteous cause, the nobles and the good people of {s12} will flock to our support.The time is ripe for us to act! I will come with you, and together, we will topple the usurper {s11} and take the power from {reg0?her:his} bloodied hands.But first, you must give me an oath of service and accept me as your rightful {reg65?leader:leader}.{***}
dlga_pretender_rebellion_ready:lord_give_oath_2|I am ready to pledge myself to your cause, {reg3?my lady:sir}.{***}
dlga_pretender_rebellion_ready:pretender_end|Let us bide our time a little longer.{***}
dlga_pretender_end:close_window|Farewell for now, then.{***}
dlga_pretender_discuss_rebellion_2:pretender_end|You are right. Perhaps, I should think about this some more.{***}
dlga_pretender_start:pretender_end|I must leave now.{***}
dlga_pretender_intro_1:pretender_intro_2.1|Name's {playername}. You might have heard it before.{***}
dlga_start:pretender_start|Greetings, {playername}.{***}
dlga_start:lord_event_choose_friend|I heard that you have befriended that {s43} called {s6}.Believe me, you can't trust that {reg0?woman:man}.You should end your dealings with {reg0?her:him}.{***}
dlga_lord_event_choose_friend:lord_event_choose_friend_renounce|I assure you, {s65}, I am no friend of {s6}.{***}
dlga_lord_event_choose_friend_renounce:lord_pretalk|That's good to hear, {playername}. I would fear for your safety otherwise.If you do encounter {s6}, be on your guard and don't believe a word.{***}
dlga_lord_event_choose_friend:lord_event_choose_friend_defend|{s6} is an honourable {reg0?woman:man}, you've no right to speak of {reg0?her:him} thus.{***}
dlga_lord_event_choose_friend_defend:lord_pretalk|As you like, {playername}.A fool you might be, but a loyal fool at the least. {s6}'s loyalty may not be so steadfast, however...{***}
dlga_lord_event_choose_friend:lord_event_choose_friend_neutral|I don't want to be involved in your quarrel with {s6}.{***}
dlga_lord_event_choose_friend_neutral:lord_pretalk|Hmph. As you wish, {playername}.Just remember that a {man/woman} needs friends in this world, and you'll never make any if you never stand with anyone.{***}
dlga_start:lord_start.4|Yes, {s0}?{***}
dlga_start:lord_start.5|It is good to see you, old friend.{***}
dlga_start:lord_start.6|Yes, {sir/my lady}?{***}
dlga_start:lord_invite_player_monarch_1|Well, {playername}. I am willing to forgive your impudence in proclaiming yourself {king/queen}, and will welcome you into my service with full honor, as one of my nobles. Shall we proceed to the oath of allegiance?{***}
dlga_lord_invite_player_monarch_1:lord_invite_2|Yes... my lord.{***}
dlga_lord_invite_2:lord_invite_3|Aye. Let us be done with the formalities then, {playername}; are you ready to swear your oath of service to me?{***}
dlga_lord_invite_3:lord_give_oath_2|Yes, {s65}.{***}
dlga_lord_invite_3:lord_enter_service_reject|No, {s65}. I cannot serve you right now.{***}
